{
  "meta": {
    "titulo": "Servir o morir",
    "subtitulo": "El servicio militar obligatorio en Cuba: trata de personas con un costo letal",
    "actualizado": "2026-07-01",
    "periodo": "1963–2023",
    "fuentePrincipal": "Maria C. Werlau · Archivo Cuba / Free Society Project (20 oct 2023)",
    "advertencia": "El costo en vidas del servicio militar por seis décadas «podría llegar a cientos, quizás miles», adicional a Angola. Sin cifras oficiales, Archivo Cuba solo ha podido documentar 54 muertes; es un esfuerzo inicial, no un total.",
    "descripcion": "Este expediente documenta el servicio militar obligatorio (SMO) en Cuba entre 1963 y 2023, descrito por la investigadora María C. Werlau, de Archivo Cuba / Free Society Project, como una forma de trata de personas con un costo letal. El propio informe advierte que el costo en vidas a lo largo de seis décadas «podría llegar a cientos, quizás miles» de muertes, adicionales a las de la guerra de Angola; sin cifras oficiales, Archivo Cuba solo ha podido documentar 54 muertes y desapariciones, un esfuerzo inicial, no un total. De esas 54 muertes documentadas, 4 corresponden a menores de edad. Por categoría, 19 se atribuyen a negligencia criminal o accidente, 14 a asesinato extrajudicial, 14 a suicidio, 2 a falta de atención médica, 2 a fusilamiento, 1 a desaparición forzada, 1 a muerte en un intento de salida por mar, y 1 sin causa informada. El expediente señala una discrepancia interna en la propia fuente: el resumen del informe declara 13 ejecuciones extrajudiciales, pero el listado nominal detalla 14 casos; el expediente muestra la lista completa. Entre los casos documentados, Francisco Fernández Galván, de 22 años, fue fusilado sin juicio en 1979 por expresar su oposición a la ideología comunista; el certificado de defunción citó otras causas, y el fiscal habría ofrecido dinero a la familia a cambio de su silencio. Alfredo Guerra Rivero, de 19 años, desapareció de su unidad militar en 2009 sin que su familia supiera nunca qué le ocurrió. El expediente reconstruye la arquitectura legal del servicio militar en nueve hitos a lo largo de 60 años. En 1963, la Ley 1.129 crea el SMO, con inscripción a los 15 años y obligación de servir desde esa edad. En 1964 se realiza el primer llamado, y ese mismo año la Comisión Interamericana de Derechos Humanos ya reportaba denuncias de reclutamiento de menores «en lugares inhóspitos e inadecuados». Entre 1965 y 1968, unos 30.000 hombres —objetores de conciencia, homosexuales, religiosos y otros calificados de «descarriados»— fueron enviados a las Unidades Militares de Ayuda a la Producción (UMAP), campos de trabajo forzoso para «reeducarlos». En 1973, la Ley 1.255 extiende el servicio a tres años y crea el Ejército Juvenil del Trabajo. En 1974, el Decreto 3.732 permite encarcelar a los «negados» que se niegan a cumplir el servicio. En 1991 el servicio activo se reduce a dos años, y en 1994 la Ley 75 de la Defensa Nacional establece el marco vigente: servicio militar activo de dos años para varones de 17 a 28 años, reserva hasta los 45, y su cumplimiento como requisito para ingresar a la universidad. En 2019, la Constitución cubana prohíbe expresamente invocar la objeción de conciencia para evadir el servicio. Y en 2023, el nuevo Código Penal Militar impone hasta 5 años de prisión por intentar evadir el servicio y entre 6 meses y 2 años por autolesionarse o falsificar documentos médicos con ese fin; la Fiscalía Militar trata el suicidio como un intento de deserción, penado con más de 10 años. El expediente traza además una continuidad entre la guerra de Angola (1975-1991) y el reclutamiento reciente de cubanos para la guerra en Ucrania. En Angola, Cuba envió 377.033 militares y unos 50.000 civiles a lo largo de 16 años; se reportan oficialmente 2.085 militares y 204 civiles muertos, aunque los veteranos sostienen que la cifra real fue mayor. Angola pagaba a Cuba unos 1.000 dólares mensuales por soldado, mientras a cada soldado se le pagaban apenas 7 pesos cubanos, equivalentes a 0,71 dólares al mes; el expediente calcula que Cuba pudo haber ingresado entre 300 y 600 millones de dólares al año por este concepto, hasta unos 9.600 millones de dólares en total. Los caídos se enterraban donde morían, y solo al final de la guerra, en la «Operación Tributo» de diciembre de 1989, se realizaron entierros formales en los 169 municipios del país. En 2023, investigaciones de The Intercept y la Fundación para los Derechos Humanos identificaron 198 pasaportes de cubanos reclutados por Rusia para la guerra en Ucrania, con hasta 746 reclutas rastreados, de los que al menos 62 parecerían pertenecer a las fuerzas especiales rusas «Avispas Negras»; Rusia ofrecía a estos reclutas unos 26.000 dólares anuales y la residencia, frente a un salario medio cubano equivalente a apenas 204 dólares al año. El expediente reconoce limitaciones explícitas: es un «esfuerzo inicial», y la propia fuente cree que el costo real en vidas del servicio militar es de cientos o miles de casos, muy por encima de los 54 documentados; varias muertes clasificadas oficialmente como suicidio son cuestionadas por las familias, que reportan golpes o disparos múltiples; las cifras de reclutamiento en Ucrania provienen de filtraciones y organizaciones del exilio, no de registros oficiales; y, como en el resto de expedientes basados en Archivo Cuba, se trata de una fuente del exilio cubano con una tesis explícita de responsabilidad estatal, cuyas cifras no han podido contrastarse con registros oficiales, que permanecen cerrados.",
    "narracion": "El servicio militar obligatorio cubano, vigente desde 1963, es descrito por la investigadora María Werlau como una forma de trata de personas con costo letal. Sin cifras oficiales, Archivo Cuba ha documentado cincuenta y cuatro muertes y desapariciones de reclutas, y advierte que el costo real podría llegar a cientos o miles, además de los muertos de la guerra de Angola. Entre las causas documentadas: negligencia criminal, asesinato extrajudicial, suicidio y hasta fusilamiento. La arquitectura legal se endurece con los años: en los años sesenta, treinta mil hombres fueron enviados a los campos de trabajo forzoso de las UMAP, las Unidades Militares de Ayuda a la Producción; en 2019 la Constitución prohibió la objeción de conciencia; y el Código Penal Militar de 2023 castiga con hasta cinco años de cárcel intentar evadir el servicio. La historia se prolonga fuera de la isla: en Angola sirvieron trescientos setenta y siete mil militares cobrando siete pesos al mes, y en 2023 se rastrearon hasta setecientos cuarenta y seis cubanos reclutados por Rusia para la guerra de Ucrania. Seis décadas después, la conscripción sigue siendo eso: cuerpos jóvenes puestos al servicio del Estado, al precio que sea.",
    "narracion_en": "This file documents Cuba's mandatory military service between nineteen sixty-three and twenty twenty-three, described by researcher María Werlau as a form of human trafficking with a lethal cost. The source itself believes the real death toll over six decades could reach hundreds, maybe thousands, in addition to those from the war in Angola. With no official figures available, only fifty-four deaths and disappearances have been documented: this is an initial effort, not a total count. Of those fifty-four cases, four are minors. Nineteen are attributed to negligence or accidents. Fourteen are extrajudicial killings. Another fourteen are recorded as suicides. The rest are split among lack of medical care, execution by firing squad, forced disappearance, and other causes. One documented case is a twenty-two-year-old man who was shot without trial in nineteen seventy-nine for expressing opposition to the regime; his death certificate cited a different cause, and the prosecutor reportedly offered the family money in exchange for silence. The file reconstructs the legal history of military service in nine moments over sixty years. In nineteen sixty-three, mandatory military service was created, with enrollment starting at age fifteen. Between nineteen sixty-five and nineteen sixty-eight, about thirty thousand men, conscientious objectors, gay men, religious believers, and others labeled as \"wayward,\" were sent to forced labor camps to be \"re-educated.\" In nineteen seventy-three, service was extended to three years. In nineteen ninety-one it was cut back to two. In nineteen ninety-four, the framework still in place today was set: two years of active service for men aged seventeen to twenty-eight, with reserve duty until age forty-five, and completion required to enter university. In twenty nineteen, the constitution explicitly bars conscientious objection as grounds for refusal. And in twenty twenty-three, a new Military Penal Code punishes attempts to evade service with up to five years in prison, and treats suicide within the military as an attempted desertion, punishable by more than ten years. The file draws a line between the war in Angola and recent recruitment for the war in Ukraine. Over sixteen years of war in Angola, Cuba sent more than three hundred seventy thousand troops; officially, two thousand eighty-five deaths are reported, though veterans say the real number was higher. Angola paid Cuba one thousand dollars a month per soldier, but each soldier was paid the equivalent of less than one dollar. In twenty twenty-three, journalistic investigations identified nearly two hundred Cubans recruited by Russia for the war in Ukraine, with salaries of twenty-six thousand dollars a year, compared with an average Cuban salary of just two hundred dollars annually. The file acknowledges that this is an initial effort, that several deaths recorded as suicide are disputed by families, and that it draws on a Cuban exile source whose figures have not been cross-checked against official records, which remain closed."
  },
  "kpis": [
    {
      "id": "caidos",
      "valor": 54,